### ISSUE TITLE
tcp-only doesn't appear to work (and other issue)

### ISSUE THREAD

**Issue by MegaManSec** [jedisct1/dnscrypt-proxy#379]
Hi,

I'm trying to use dnscrypt, however I'm receiving the error:
[INFO] Refetching server certificates
[ERROR] Unable to retrieve server certificates

I'm using the command:
dnscrypt-proxy --local-address=127.0.0.1:52 --resolver-name=d0wn-random-ns2  --tcp-only --loglevel 7

First issue:
According to tcpdump, UDP is being used despite the --tcp-only flag being used:
10:53:49.148785 IP 10.1.63.115.52783 > 185.14.29.140.27015: UDP, length 50
E..N.=@.@..S
dnSCrYpT-CERt.rAndOM2.D0wN.BiZ.....

Second issue:
It doesn't work since I can't fetch the certificate.

Any suggestions as to how I could debug this, to find out why I can't get the certificate? 

Thanks!

**Comment by MegaManSec** [comment]
Nevermind, I see this has been reported in bug #373 and isn't a bug.
Is there a way to manually get the certificate?


Thanks

**Comment by jedisct1** [comment]
Hi,

Yes, you can manually retrieve the certificate:

   drill -p 27015 txt 2.dnscrypt-cert.random2.d0wn.biz @185.14.29.140

or

    dig -p 27015 txt 2.dnscrypt-cert.random2.d0wn.biz @185.14.29.140

What response are you getting?

**Comment by MegaManSec** [comment]
Neither connect; where I am blocks port 53 to any network other than its own.

**Comment by jedisct1** [comment]
This specific configuration uses port 27015.

**Comment by MegaManSec** [comment]
$ dig -p 27015 txt 2.dnscrypt-cert.random2.d0wn.biz @185.14.29.140

; <<>> DiG 9.9.5-3ubuntu0.8-Ubuntu <<>> -p 27015 txt 2.dnscrypt-cert.random2.d0wn.biz @185.14.29.140
;; global options: +cmd
;; connection timed out; no servers could be reached

With tcpdump:
E..Y%n..@.5.
dnscrypt-cert.random2.d0wn.biz.......)........
11:08:18.673433 IP 10.1.63.115.54509 > 185.14.29.140.27015: UDP, length 61
E..Y'S..@.33
dnscrypt-cert.random2.d0wn.biz.......)........
11:08:23.673662 IP 10.1.63.115.54509 > 185.14.29.140.27015: UDP, length 61
E..Y)...@.0.
dnscrypt-cert.random2.d0wn.biz.......)........
^C



$ drill -p 443 txt 2.dnscrypt-cert.opendns.com @212.47.228.136
Error: error sending query: Could not send or receive, because of network error

Tcpdump:
$ sudo tcpdump -i any 'host 185.14.29.140 or host 212.47.228.136' -A -n
tcpdump: verbose output suppressed, use -v or -vv for full protocol decode
listening on any, link-type LINUX_SLL (Linux cooked), capture size 65535 bytes
11:09:33.135048 IP 10.1.63.115.40233 > 212.47.228.136.443: UDP, length 45
E..Iat@.@...
dnscrypt-cert.opendns.com.....
11:09:38.140236 IP 10.1.63.115.46128 > 212.47.228.136.443: UDP, length 45
E..Ic @.@..W
dnscrypt-cert.opendns.com.....
11:09:43.145401 IP 10.1.63.115.57706 > 212.47.228.136.443: UDP, length 45
E..Ie.@.@...
dnscrypt-cert.opendns.com.....

**Comment by jedisct1** [comment]
For `212.47.228.136`, the name should be `2.dnscrypt-cert.fr.dnscrypt.org`.

**Comment by MegaManSec** [comment]
Apologies.. It's early for me.

$ drill -p 27015 txt 2.dnscrypt-cert.random2.d0wn.biz @185.14.29.140
Error: error sending query: Could not send or receive, because of network error
megamansec@megamansec:~/configs$ dig -p 27015 txt 2.dnscrypt-cert.random2.d0wn.biz @185.14.29.140

; <<>> DiG 9.9.5-3ubuntu0.8-Ubuntu <<>> -p 27015 txt 2.dnscrypt-cert.random2.d0wn.biz @185.14.29.140
;; global options: +cmd
;; connection timed out; no servers could be reached

**Comment by jedisct1** [comment]
Since you seem to be willing to use `random2.d0wn.biz`, can you allow packets (both TCP and UDP) to port 27015 on your firewall?

**Comment by MegaManSec** [comment]
I'm willing to use any server. It seems that no matter what server I use, the cert retrieval fails.

**Comment by jedisct1** [comment]
Most servers use port 443, so you need to make sure that queries sent to port 443 (including UDP) are also allowed by your firewall.

**Comment by MegaManSec** [comment]
Yep, it seems that most, if not all, UDP ports are being blocked by the firewall. Is there any way to workaround this for dnscrypt?

Thanks

**Comment by jedisct1** [comment]
Unfortunately not. It was not designed to get around policies.
You may want to use a VPN or try [dnssec-trigger](https://www.nlnetlabs.nl/projects/dnssec-trigger/) instead.

**Comment by MegaManSec** [comment]
If I can downloaded the certificate elsewhere, would it be possible to manually use it?

**Comment by jedisct1** [comment]
Certificates are constantly being updated. They are supposed to last 24 hours max, so this really needs to be automated.
Try dnssec-trigger. It uses traditional TLS certificates and communication.

**Comment by SuppSandroB** [comment]
I examined same behaviour and change a little bit that can work just over tcp. #374 
As far I can tell only Cisco OpenDNS provider works. 
There is change for server side but no official release yet.
https://github.com/Cofyc/dnscrypt-wrapper/pull/73
But it makes a lot of tcp requests and should be used 
with some kind of dns cache (pdnsd, unbound,...)
and also allowed by firewall, policies.

**Comment by MegaManSec** [comment]
Awesome.
This issue isn't an issue, so closing.
